{
  "$schema": "https://json-schema.org/draft/2020-12/schema",
  "$id": "https://example.invalid/project-workflow-v2/execution-obligation.schema.json",
  "title": "PWv2.1 Execution Obligation",
  "type": "object",
  "additionalProperties": false,
  "required": [
    "kind",
    "schema_version",
    "obligation_id",
    "rule_id",
    "role",
    "subject",
    "authority_bundle",
    "prerequisites",
    "constraints",
    "completion",
    "freshness",
    "mutation"
  ],
  "properties": {
    "kind": {
      "const": "pwv2_execution_obligation"
    },
    "schema_version": {
      "const": 1
    },
    "obligation_id": {
      "type": "string",
      "pattern": "^sha256:[0-9a-f]{64}$"
    },
    "rule_id": {
      "type": "string",
      "pattern": "^PWV21-K[0-9]{3}$"
    },
    "role": {
      "type": "string",
      "minLength": 1,
      "pattern": "\\S"
    },
    "subject": {
      "$ref": "#/$defs/exact_ref"
    },
    "authority_bundle": {
      "type": "array",
      "minItems": 1,
      "items": {
        "$ref": "#/$defs/authority_source"
      }
    },
    "prerequisites": {
      "type": "array",
      "items": {
        "type": "string",
        "minLength": 1,
        "pattern": "\\S"
      }
    },
    "constraints": {
      "type": "array",
      "items": {
        "type": "string",
        "minLength": 1,
        "pattern": "\\S"
      }
    },
    "completion": {
      "$ref": "#/$defs/completion"
    },
    "freshness": {
      "type": "object",
      "additionalProperties": false,
      "required": [
        "fingerprint",
        "material"
      ],
      "properties": {
        "fingerprint": {
          "type": "string",
          "pattern": "^sha256:[0-9a-f]{64}$"
        },
        "material": {
          "$ref": "#/$defs/freshness_material"
        }
      }
    },
    "mutation": {
      "$ref": "#/$defs/mutation"
    }
  },
  "$defs": {
    "exact_ref": {
      "type": "object",
      "additionalProperties": false,
      "required": [
        "repository",
        "commit",
        "path",
        "blob"
      ],
      "properties": {
        "repository": {
          "type": "string",
          "pattern": "^[^/]+/[^/]+$"
        },
        "commit": {
          "type": "string",
          "pattern": "^[0-9a-f]{40}$"
        },
        "path": {
          "type": "string",
          "minLength": 1,
          "pattern": "^(?!/)(?!.*//)(?!.*(?:^|/)\\.{1,2}(?:/|$))(?!.*/$)[^\\u0000]+$"
        },
        "blob": {
          "type": "string",
          "pattern": "^[0-9a-f]{40}$"
        }
      }
    },
    "authority_source": {
      "type": "object",
      "additionalProperties": false,
      "required": [
        "repository",
        "commit",
        "path",
        "blob",
        "content_sha256",
        "content"
      ],
      "properties": {
        "repository": {
          "type": "string",
          "pattern": "^[^/]+/[^/]+$"
        },
        "commit": {
          "type": "string",
          "pattern": "^[0-9a-f]{40}$"
        },
        "path": {
          "type": "string",
          "minLength": 1,
          "pattern": "^(?!/)(?!.*//)(?!.*(?:^|/)\\.{1,2}(?:/|$))(?!.*/$)[^\\u0000]+$"
        },
        "blob": {
          "type": "string",
          "pattern": "^[0-9a-f]{40}$"
        },
        "content_sha256": {
          "type": "string",
          "pattern": "^sha256:[0-9a-f]{64}$"
        },
        "content": {
          "type": "string"
        }
      }
    },
    "completion": {
      "type": "object",
      "additionalProperties": false,
      "required": [
        "acceptance",
        "tests",
        "evidence"
      ],
      "properties": {
        "acceptance": {
          "type": "array",
          "items": {
            "type": "string",
            "minLength": 1,
            "pattern": "\\S"
          }
        },
        "tests": {
          "type": "array",
          "items": {
            "type": "string",
            "minLength": 1,
            "pattern": "\\S"
          }
        },
        "evidence": {
          "type": "array",
          "items": {
            "type": "string",
            "minLength": 1,
            "pattern": "\\S"
          }
        }
      }
    },
    "mutation": {
      "type": "object",
      "additionalProperties": false,
      "required": [
        "preconditions",
        "postconditions"
      ],
      "properties": {
        "preconditions": {
          "type": "array",
          "items": {
            "type": "object",
            "additionalProperties": false,
            "required": [
              "path",
              "equals"
            ],
            "properties": {
              "path": {
                "type": "string",
                "pattern": "^[a-z_][a-z0-9_]*(?:\\.[a-z_][a-z0-9_]*)*$"
              },
              "equals": {
                "$ref": "#/$defs/telemetry_free_json"
              }
            }
          }
        },
        "postconditions": {
          "type": "array",
          "items": {
            "type": "object",
            "additionalProperties": false,
            "required": [
              "path",
              "equals"
            ],
            "properties": {
              "path": {
                "type": "string",
                "pattern": "^[a-z_][a-z0-9_]*(?:\\.[a-z_][a-z0-9_]*)*$"
              },
              "equals": {
                "$ref": "#/$defs/telemetry_free_json"
              }
            }
          }
        }
      }
    },
    "freshness_material": {
      "type": "object",
      "additionalProperties": false,
      "required": [
        "subject",
        "authority",
        "prerequisites",
        "constraints",
        "completion",
        "mutation",
        "inputs"
      ],
      "properties": {
        "subject": {
          "$ref": "#/$defs/exact_ref"
        },
        "authority": {
          "type": "array",
          "minItems": 1,
          "items": {
            "$ref": "#/$defs/exact_ref"
          }
        },
        "prerequisites": {
          "type": "array",
          "items": {
            "type": "string",
            "minLength": 1,
            "pattern": "\\S"
          }
        },
        "constraints": {
          "type": "array",
          "items": {
            "type": "string",
            "minLength": 1,
            "pattern": "\\S"
          }
        },
        "completion": {
          "$ref": "#/$defs/completion"
        },
        "mutation": {
          "$ref": "#/$defs/mutation"
        },
        "inputs": {
          "type": "object",
          "$ref": "#/$defs/telemetry_free_json"
        }
      }
    },
    "telemetry_free_json": {
      "if": {
        "type": "object"
      },
      "then": {
        "propertyNames": {
          "not": {
            "pattern": "^(?:[pP][rR][oO][vV][iI][dD][eE][rR]|[mM][oO][dD][eE][lL]|[wW][oO][rR][kK][eE][rR]|[sS][eE][sS][sS][iI][oO][nN]|[rR][eE][tT][rR][yY]|[rR][eE][tT][rR][iI][eE][sS]|[wW][oO][rR][kK][tT][rR][eE][eE]|[pP][aA][sS][eE][oO]|[rR][uU][nN][tT][iI][mM][eE]|[iI][nN][vV][oO][cC][aA][tT][iI][oO][nN]|[sS][cC][hH][eE][dD][uU][lL][eE][rR]).*"
          }
        },
        "additionalProperties": {
          "$ref": "#/$defs/telemetry_free_json"
        }
      },
      "else": {
        "if": {
          "type": "array"
        },
        "then": {
          "items": {
            "$ref": "#/$defs/telemetry_free_json"
          }
        }
      }
    }
  }
}
