{
  "authority_bundle": [
    {
      "blob": "1b9e6c5698f10481fb1e215b7caf54edf4adcb8a",
      "commit": "aaaaaaaaaaaaaaaaaaaaaaaaaaaaaaaaaaaaaaaa",
      "content": "# Decision\naccepted\n",
      "content_sha256": "sha256:e849c2b42890a8acf68ee3b68ba9250f50b5ff49ea14a699a16b0b84fb4a34b2",
      "path": "decisions/A.md",
      "repository": "owner/project"
    },
    {
      "blob": "53abf26f4ff6053bf6b09601d397a769865a03ff",
      "commit": "aaaaaaaaaaaaaaaaaaaaaaaaaaaaaaaaaaaaaaaa",
      "content": "# Requirements\naccepted\n",
      "content_sha256": "sha256:6a17cfcea893926e9b8e0176b6818ce1507aceae59b8d1c8ce2c9dd6db5add38",
      "path": "requirements/R.md",
      "repository": "owner/project"
    }
  ],
  "completion": {
    "acceptance": [
      "typed contract accepted"
    ],
    "evidence": [
      "durable evidence"
    ],
    "tests": [
      "contract suite GREEN"
    ]
  },
  "constraints": [
    "canonical writes are coordinator-owned"
  ],
  "freshness": {
    "fingerprint": "sha256:d48d536bbd1a031ef7d2005c927517dc16fdc74f14a83e09515b936316cf0c0a",
    "material": {
      "authority": [
        {
          "blob": "1b9e6c5698f10481fb1e215b7caf54edf4adcb8a",
          "commit": "aaaaaaaaaaaaaaaaaaaaaaaaaaaaaaaaaaaaaaaa",
          "path": "decisions/A.md",
          "repository": "owner/project"
        },
        {
          "blob": "53abf26f4ff6053bf6b09601d397a769865a03ff",
          "commit": "aaaaaaaaaaaaaaaaaaaaaaaaaaaaaaaaaaaaaaaa",
          "path": "requirements/R.md",
          "repository": "owner/project"
        }
      ],
      "completion": {
        "acceptance": [
          "typed contract accepted"
        ],
        "evidence": [
          "durable evidence"
        ],
        "tests": [
          "contract suite GREEN"
        ]
      },
      "constraints": [
        "canonical writes are coordinator-owned"
      ],
      "inputs": {
        "board_revision": 8,
        "card_id": "M02-T01"
      },
      "mutation": {
        "preconditions": [
          {
            "path": "board.revision",
            "equals": 8
          }
        ],
        "postconditions": [
          {
            "path": "board.revision",
            "equals": 9
          }
        ]
      },
      "prerequisites": [
        "M01-T01 DONE"
      ],
      "subject": {
        "blob": "cccccccccccccccccccccccccccccccccccccccc",
        "commit": "bbbbbbbbbbbbbbbbbbbbbbbbbbbbbbbbbbbbbbbb",
        "path": "implementation/cards/M02-T01.md",
        "repository": "owner/project"
      }
    }
  },
  "kind": "pwv2_execution_obligation",
  "mutation": {
    "preconditions": [
      {
        "path": "board.revision",
        "equals": 8
      }
    ],
    "postconditions": [
      {
        "path": "board.revision",
        "equals": 9
      }
    ]
  },
  "obligation_id": "sha256:cd82f63081b606cf66ed00a9af03527034fb83e09885aad7f3aadb4e6bbc9b56",
  "prerequisites": [
    "M01-T01 DONE"
  ],
  "role": "execution_prep",
  "rule_id": "PWV21-K011",
  "schema_version": 1,
  "subject": {
    "blob": "cccccccccccccccccccccccccccccccccccccccc",
    "commit": "bbbbbbbbbbbbbbbbbbbbbbbbbbbbbbbbbbbbbbbb",
    "path": "implementation/cards/M02-T01.md",
    "repository": "owner/project"
  }
}
